### ISSUE TITLE
Medic Week 8 Throughput went down

### ISSUE THREAD

**Issue by Zelldon** [camunda/zeebe#11975]
**Describe the bug**

The throughput of the medic week 8 went down, it looks like that the workers are no longer keeping up with the load.

In the overall, we can see the difference between all other benchmarks
![overall](https://user-images.githubusercontent.com/2758593/223962068-36bdc117-d3b2-4bfd-83e1-7792513fc786.png)

It looks like it started on 07.03.2022 around 18:20.

![general](https://user-images.githubusercontent.com/2758593/223962148-cdc08d7c-c47e-4509-8a36-52005de417dd.png)

Interestingly is that around 2100 we reached 300 PI creations/s. Which is weird, since for the benchmark it should be 150 PI/s. 300 is the default for our helm charts, might be that someone has applied an update?

But based on the secrets, we see no helm updates:

```
$ k get secrets 
NAME                                                              TYPE                                  DATA   AGE
default-token-rhglr                                               kubernetes.io/service-account-token   3      17d
medic-y-2023-cw-08-5ca2147-benchmark-zeebe-gateway-gateway4k4tg   kubernetes.io/service-account-token   3      17d
medic-y-2023-cw-08-5ca2147-benchmark-zeebe-token-mhhnk            kubernetes.io/service-account-token   3      17d
sh.helm.release.v1.medic-y-2023-cw-08-5ca2147-benchmark.v1        helm.sh/release.v1                    1      17d


```

**To Reproduce**

Not clear yet.

**Expected behavior**

Continuous keeping up with the load.

**Comment by Zelldon** [comment]
Starter config looks as expected:

```
    Environment:
      JDK_JAVA_OPTIONS:  -Dconfig.override_with_env_vars=true -Dapp.brokerUrl=medic-y-2023-cw-08-5ca2147-benchmark-zeebe-gateway:26500 -Dapp.starter.rate=150 -Dapp.starter.durationLimit=0 -Dzeebe.client.requestTimeout=62000 -XX:+HeapDumpOnOutOfMemoryError
```

Not clear yet why we now reach 300 instance creations.

**Comment by Zelldon** [comment]
For posterity, there are several pods in error state (mostly because of node shutdowns).

```
$ kgpo
NAME                                                              READY   STATUS      RESTARTS        AGE
camunda-platform-curator-27972540-nxxlb                           0/1     Completed   0               5m4s
elasticsearch-master-0                                            1/1     Running     0               42h
elasticsearch-master-1                                            1/1     Running     0               4d11h
elasticsearch-master-2                                            1/1     Running     0               9h
leader-balancer-27972540-rrpcf                                    0/1     Completed   0               5m3s
medic-y-2023-cw-08-5ca2147-benchmark-zeebe-0                      1/1     Running     0               8d
medic-y-2023-cw-08-5ca2147-benchmark-zeebe-1                      1/1     Running     0               5d5h
medic-y-2023-cw-08-5ca2147-benchmark-zeebe-2                      1/1     Running     0               8d
medic-y-2023-cw-08-5ca2147-benchmark-zeebe-gateway-5c8564c29pwh   0/1     Error       0               43h
medic-y-2023-cw-08-5ca2147-benchmark-zeebe-gateway-5c8564chpb9h   0/1     Error       0               5d17h
medic-y-2023-cw-08-5ca2147-benchmark-zeebe-gateway-5c8564ckzbqx   1/1     Running     0               9h
medic-y-2023-cw-08-5ca2147-benchmark-zeebe-gateway-5c8564cm7gjl   0/1     Error       0               3d4h
medic-y-2023-cw-08-5ca2147-benchmark-zeebe-gateway-5c8564cnxcgq   1/1     Running     2 (2d1h ago)    4d7h
medic-y-2023-cw-08-5ca2147-benchmark-zeebe-gateway-5c8564cpmm24   0/1     Error       0               2d19h
medic-y-2023-cw-08-5ca2147-benchmark-zeebe-gateway-5c8564cwggnk   0/1     Error       0               5d11h
starter-7c9f86fcbb-48d6x                                          0/1     Error       1 (2d18h ago)   2d19h
starter-7c9f86fcbb-4svrz                                          0/1     Error       0               42h
starter-7c9f86fcbb-66xf6                                          1/1     Running     3 (128m ago)    37h
starter-7c9f86fcbb-jkdhz                                          0/1     Error       1               3d17h
starter-7c9f86fcbb-jvf5h                                          0/1     Error       3 (43h ago)     2d18h
starter-7c9f86fcbb-mh44r                                          0/1     Error       0               43h
worker-6b7c4769cc-45nkv                                           0/1     Error       0               4d6h
worker-6b7c4769cc-6bqdf                                           1/1     Running     0               42h
worker-6b7c4769cc-csh6x                                           1/1     Running     0               3d4h
worker-6b7c4769cc-ssxqx                                           0/1     Error       0               43h
worker-6b7c4769cc-wfdvm                                           0/1     Error       0               3d19h
worker-6b7c4769cc-wtsng                                           1/1     Running     0               7d18h
worker-6b7c4769cc-x6rfr                                           0/1     Error       0               3d4h
worker-6b7c4769cc-xxg5w                                           0/1     Error       0               2d18h


```

**Comment by Zelldon** [comment]
I wanted to understand why we have 300 PI creations instead of 150. In order to investigate that  I used `kubectl debug` with an docker image which comes with some network tools

- https://wyssmann.com/blog/2021/11/docker-images-for-debugging-network-issues-in-k8s/
- https://www.cyberciti.biz/faq/how-to-check-open-ports-in-linux-using-the-cli/

```
$  kubectl debug -it --image=nicolaka/netshoot --target=zeebe-gateway medic-y-2023-cw-08-5ca2147-benchmark-zeebe-gateway-5c8564cnxcgq
```

I ran some smaller checks regarding open PORTS on both gateways

```
# netstat -tulpn | grep LISTEN
tcp        0      0 0.0.0.0:9600            0.0.0.0:*               LISTEN      7/java
tcp        0      0 0.0.0.0:26500           0.0.0.0:*               LISTEN      7/java
tcp        0      0 10.0.12.194:26502       0.0.0.0:*               LISTEN      7/java
# ss -tulpn
Netid   State    Recv-Q   Send-Q     Local Address:Port      Peer Address:Port   Process                          
udp     UNCONN   0        0            10.0.12.194:26502          0.0.0.0:*       users:(("java",pid=7,fd=199))   
tcp     LISTEN   0        100              0.0.0.0:9600           0.0.0.0:*       users:(("java",pid=7,fd=178))   
tcp     LISTEN   0        1024             0.0.0.0:26500          0.0.0.0:*       users:(("java",pid=7,fd=206))   
tcp     LISTEN   0        128          10.0.12.194:26502          0.0.0.0:*       users:(("java",pid=7,fd=194))  
```

Based on https://stackoverflow.com/questions/33570391/how-to-see-all-request-urls-the-server-is-doing-final-urls I wanted to find out via tcdump what requests are coming in.

First it looked like only metrics.
```
#  tcpdump -i any -A -vv -s 0 |  grep -e "Host:"
tcpdump: data link type LINUX_SLL2
tcpdump: listening on any, link-type LINUX_SLL2 (Linux cooked v2), snapshot length 262144 bytes
Host: 10.0.12.194:9600
Host: 10.0.12.194:9600
Host: 10.0.12.194:9600
````

```
$  kubectl debug -it --image=nicolaka/netshoot --target=zeebe-gateway medic-y-2023-cw-08-5ca2147-benchmark-zeebe-gateway-5c8564ckzbqx
Targeting container "zeebe-gateway". If you don't see processes from this container it may be because the container runtime doesn't support this feature.
Defaulting debug container name to debugger-r48mh.
If you don't see a command prompt, try pressing enter.
medic-y-2023-cw-08-5ca2147-benchmark-zeebe-gateway-5c8564ckzbqx# 

# netstat -tulpn | grep LISTEN
tcp        0      0 0.0.0.0:9600            0.0.0.0:*               LISTEN      7/java
tcp        0      0 0.0.0.0:26500           0.0.0.0:*               LISTEN      7/java
tcp        0      0 10.0.20.58:26502        0.0.0.0:*               LISTEN      7/java

#  ss -tulpn
Netid   State    Recv-Q   Send-Q     Local Address:Port      Peer Address:Port   Process                          
udp     UNCONN   0        0             10.0.20.58:26502          0.0.0.0:*       users:(("java",pid=7,fd=199))   
tcp     LISTEN   0        100              0.0.0.0:9600           0.0.0.0:*       users:(("java",pid=7,fd=178))   
tcp     LISTEN   0        1024             0.0.0.0:26500          0.0.0.0:*       users:(("java",pid=7,fd=206))   
tcp     LISTEN   0        128           10.0.20.58:26502          0.0.0.0:*       users:(("java",pid=7,fd=194))

#  tcpdump -i any -A -vv -s 0 |  grep -e "Host:"
tcpdump: data link type LINUX_SLL2
tcpdump: listening on any, link-type LINUX_SLL2 (Linux cooked v2), snapshot length 262144 bytes

No more data.
```

But adjusting the grep for the tcdump, helped to see more information. For example:

```
medic-y-2023-cw-08-5ca2147-benchmark-zeebe-gateway-5c8564ckzbqx.26500 > 10.0.33.207.58226: Flags [P.], cksum 0x4a40 (incorrect -> 0x249e), seq 41175:41192, ack 23912775, win 24312, options [nop,nop,TS val 3738917251 ecr 3628424487], length 17
    medic-y-2023-cw-08-5ca2147-benchmark-zeebe-gateway-5c8564ckzbqx.26500 > 10.0.12.197.41854: Flags [.], cksum 0x3525 (incorrect -> 0xc676), seq 1, ack 81, win 24563, options [nop,nop,TS val 964786642 ecr 1392110396], length 0
    medic-y-2023-cw-08-5ca2147-benchmark-zeebe-gateway-5c8564ckzbqx.26500 > 10.0.33.207.58226: Flags [.], cksum 0x4a2f (incorrect -> 0xa733), seq 41192, ack 24001067, win 23918, options [nop,nop,TS val 3738917285 ecr 3628424487], length 0
    medic-y-2023-cw-08-5ca2147-benchmark-zeebe-gateway-5c8564ckzbqx.26500 > 10.0.33.207.58226: Flags [.], cksum 0x4a2f (incorrect -> 0xe526), seq 41864, ack 24442595, win 24238, options [nop,nop,TS val 3738917451 ecr 3628424687], length 0
    medic-y-2023-cw-08-5ca2147-benchmark-zeebe-gateway-5c8564ckzbqx.26500 > 10.0.33.207.58226:

```


I checked the IP's for all running applications:

```
$ k get pod starter-7c9f86fcbb-66xf6 -o json | jq '.status.podIP'
"10.0.33.207"
[cqjawa ~/ cluster: zeebe-cluster ns:medic-y-2023-cw-08-5ca2147-benchmark]$ k get pod worker-6b7c4769cc-csh6x -o json | jq '.status.podIP'
"10.0.12.197"
[cqjawa ~/ cluster: zeebe-cluster ns:medic-y-2023-cw-08-5ca2147-benchmark]$ k get pod worker-6b7c4769cc-6bqdf -o json | jq '.status.podIP'
"10.0.21.6"
[cqjawa ~/ cluster: zeebe-cluster ns:medic-y-2023-cw-08-5ca2147-benchmark]$ k get pod worker-6b7c4769cc-wtsng -o json | jq '.status.podIP'
"10.0.4.7"
```

Playing a bit more with [tcpdump](https://www.tcpdump.org/manpages/tcpdump.1.html), We can see for example that one gateway gets several jobsAvailable notifications.

```
tcpdump -i any -A -vv -s 0 -c 100

09:45:16.367561 eth0  In  IP (tos 0x0, ttl 62, id 62332, offset 0, flags [DF], proto TCP (6), length 88)
    medic-y-2023-cw-08-5ca2147-benchmark-zeebe-0.medic-y-2023-cw-08-5ca2147-benchmark-zeebe.medic-y-2023-cw-08-5ca2147-benchmark.svc.cluster.local.46514 > medic-y-2023-cw-08-5ca2147-benchmark-zeebe-gateway-5c8564cnxcgq.26502: Flags [P.], cksum 0x8e0e (correct), seq 252:288, ack 50, win 16384, options [nop,nop,TS val 3377501769 ecr 616313562], length 36
E..X.|@.>..]
.?.
.....g........J..@........
.P.I$.2.....r..benchmark-tas...jobsAvailable
09:45:16.367733 eth0  Out IP (tos 0x0, ttl 64, id 1134, offset 0, flags [DF], proto TCP (6), length 59)
    medic-y-2023-cw-08-5ca2147-benchmark-zeebe-gateway-5c8564cnxcgq.26502 > medic-y-2023-cw-08-5ca2147-benchmark-zeebe-0.medic-y-2023-cw-08-5ca2147-benchmark-zeebe.medic-y-2023-cw-08-5ca2147-benchmark.svc.cluster.local.46514: Flags [P.], cksum 0x5ff3 (incorrect -> 0x8f20), seq 50:57, ack 288, win 340, options [nop,nop,TS val 616313614 ecr 3377501769], length 7
E..;.n@.@...
...
.?.g......J.......T_......
$.3..P.I....r..
09:45:16.368360 eth0  In  IP (tos 0x0, ttl 62, id 62333, offset 0, flags [DF], proto TCP (6), length 52)
    medic-y-2023-cw-08-5ca2147-benchmark-zeebe-0.medic-y-2023-cw-08-5ca2147-benchmark-zeebe.medic-y-2023-cw-08-5ca2147-benchmark.svc.cluster.local.46514 > medic-y-2023-cw-08-5ca2147-benchmark-zeebe-gateway-5c8564cnxcgq.26502: Flags [.], cksum 0xbd36 (correct), seq 288, ack 57, win 16384, options [nop,nop,TS val 3377501770 ecr 616313614], length 0
E..4.}@.>...
.?.
.....g........Q..@..6.....
.P.J$.3.
09:45:16.422837 eth0  In  IP (tos 0x0, ttl 62, id 62334, offset 0, flags [DF], proto TCP (6), length 88)
    medic-y-2023-cw-08-5ca2147-benchmark-zeebe-0.medic-y-2023-cw-08-5ca2147-benchmark-zeebe.medic-y-2023-cw-08-5ca2147-benchmark.svc.cluster.local.46514 > medic-y-2023-cw-08-5ca2147-benchmark-zeebe-gateway-5c8564cnxcgq.26502: Flags [P.], cksum 0x8d72 (correct), seq 288:324, ack 57, win 16384, options [nop,nop,TS val 3377501824 ecr 616313614], length 36
E..X.~@.>..[
.?.
.....g........Q..@..r.....
.P..$.3.....r..benchmark-tas...jobsAvailable
09:45:16.422956 eth0  Out IP (tos 0x0, ttl 64, id 1135, offset 0, flags [DF], proto TCP (6), length 59)
    medic-y-2023-cw-08-5ca2147-benchmark-zeebe-gateway-5c8564cnxcgq.26502 > medic-y-2023-cw-08-5ca2147-benchmark-zeebe-0.medic-y-2023-cw-08-5ca2147-benchmark-zeebe.medic-y-2023-cw-08-5ca2147-benchmark.svc.cluster.local.46514: Flags [P.], cksum 0x5ff3 (incorrect -> 0x8e81), seq 57:64, ack 324, win 340, options [nop,nop,TS val 616313669 ecr 3377501824], length 7
E..;.o@.@...
...
.?.g......Q...%...T_......
$.3E.P......r..
09:45:16.423112 eth0  In  IP (tos 0x0, ttl 62, id 62335, offset 0, flags [DF], proto TCP (6), length 52)
    medic-y-2023-cw-08-5ca2147-benchmark-zeebe-0.medic-y-2023-cw-08-5ca2147-benchmark-zeebe.medic-y-2023-cw-08-5ca2147-benchmark.svc.cluster.local.46514 > medic-y-2023-cw-08-5ca2147-benchmark-zeebe-gateway-5c8564cnxcgq.26502: Flags [.], cksum 0xbc9d (correct), seq 324, ack 64, win 16384, options [nop,nop,TS val 3377501825 ecr 616313669], length 0
E..4..@.>..~
.?.
.....g....%...X..@........
.P..$.3E
```

The other gateway seem to get the starter request (I haven't spotted yet any other IP than our expected ones)

```
09:54:02.874577 eth0  In  IP 10.0.33.207.58226 > medic-y-2023-cw-08-5ca2147-benchmark-zeebe-gateway-5c8564ckzbqx.26500: Flags [P.], seq 17:17672, ack 1, win 3434, options [nop,nop,TS val 3629678547 ecr 3740171305], length 17655
09:54:02.874890 eth0  In  IP 10.0.33.207.58226 > medic-y-2023-cw-08-5ca2147-benchmark-zeebe-gateway-5c8564ckzbqx.26500: Flags [P.], seq 17672:17689, ack 18, win 3434, options [nop,nop,TS val 3629678547 ecr 3740171311], length 17
09:54:02.875697 eth0  In  IP medic-y-2023-cw-08-5ca2147-benchmark-zeebe-2.medic-y-2023-cw-08-5ca2147-benchmark-zeebe.medic-y-2023-cw-08-5ca2147-benchmark.svc.cluster.local.26501 > medic-y-2023-cw-08-5ca2147-benchmark-zeebe-gateway-5c8564ckzbqx.50964: Flags [.], ack 13997, win 331, options [nop,nop,TS val 4071928739 ecr 1009230412], length 0
09:54:02.879040 eth0  In  IP medic-y-2023-cw-08-5ca2147-benchmark-zeebe-0.medic-y-2023-cw-08-5ca2147-benchmark-zeebe.medic-y-2023-cw-08-5ca2147-benchmark.svc.cluster.local.26501 > medic-y-2023-cw-08-5ca2147-benchmark-zeebe-gateway-5c8564ckzbqx.41560: Flags [P.], seq 3802159424:3802159488, ack 533632996, win 331, options [nop,nop,TS val 2820593785 ecr 1426392], length 64
09:54:02.879649 eth0  In  IP medic-y-2023-cw-08-5ca2147-benchmark-zeebe-1.medic-y-2023-cw-08-5ca2147-benchmark-zeebe.medic-y-2023-cw-08-5ca2147-benchmark.svc.cluster.local.26501 > medic-y-2023-cw-08-5ca2147-benchmark-zeebe-gateway-5c8564ckzbqx.49602: Flags [.], ack 27994, win 331, options [nop,nop,TS val 3518641424 ecr 165239249], length 0
09:54:02.881255 eth0  In  IP 10.0.33.207.58226 > medic-y-2023-cw-08-5ca2147-benchmark-zeebe-gateway-5c8564ckzbqx.26500: Flags [P.], seq 17689:35345, ack 18, win 3434, options [nop,nop,TS val 3629678553 ecr 3740171311], length 17656
09:54:02.881606 eth0  In  IP 10.0.33.207.58226 > medic-y-2023-cw-08-5ca2147-benchmark-zeebe-gateway-5c8564ckzbqx.26500: Flags [P.], seq 35345:35362, ack 35, win 3434, options [nop,nop,TS val 3629678554 ecr 3740171318], length 17
09:54:02.882322 eth0  In  IP medic-y-2023-cw-08-5ca2147-benchmark-zeebe-0.medic-y-2023-cw-08-5ca2147-benchmark-zeebe.medic-y-2023-cw-08-5ca2147-benchmark.svc.cluster.local.26501 > medic-y-2023-cw-08-5ca2147-benchmark-zeebe-gateway-5c8564ckzbqx.41560: Flags [.], ack 13998, win 331, options [nop,nop,TS val 2820593789 ecr 1426409], length 0
09:54:02.882605 eth0  In  IP medic-y-2023-cw-08-5ca2147-benchmark-zeebe-0.medic-y-2023-cw-08-5ca2147-benchmark-zeebe.medic-y-2023-cw-08-5ca2147-benchmark.svc.cluster.local.26501 > medic-y-2023-cw-08-5ca2147-benchmark-zeebe-gateway-5c8564ckzbqx.41560: Flags [P.], seq 64:128, ack 13998, win 331, options [nop,nop,TS val 2820593789 ecr 1426409], length 64

```

**Comment by Zelldon** [comment]
Looks like that `medic-y-2023-cw-08-5ca2147-benchmark-zeebe-gateway-5c8564cnxcgq` is getting a lot of job notifications, where `medic-y-2023-cw-08-5ca2147-benchmark-zeebe-gateway-5c8564ckzbqx`, doesn't get much.


```
medic-y-2023-cw-08-5ca2147-benchmark-zeebe-gateway-5c8564cnxcgq#  tcpdump -i any -A -s 0 -c 100 | grep -e 'jobs'
tcpdump: data link type LINUX_SLL2
tcpdump: verbose output suppressed, use -v[v]... for full protocol decode
listening on any, link-type LINUX_SLL2 (Linux cooked v2), snapshot length 262144 bytes
.i.I$.h.....s..benchmark-tas...jobsAvailable
.9..n.......x..benchmark-tas...jobsAvailable
.i..$.i.....s..benchmark-tas...jobsAvailable
.i..$.iO....s..benchmark-tas...jobsAvailable
y*f.........<..benchmark-tas...jobsAvailable
.9..n.......x..benchmark-tas...jobsAvailable
.i..$.i.....s..benchmark-tas...jobsAvailable
.i.A$.i.....s..benchmark-tas...jobsAvailable
.i.z$.j.....s..benchmark-tas...jobsAvailable
.9..n.......x..benchmark-tas...jobsAvailable
y*g....n....<..benchmark-tas...jobsAvailable
.i..$.j?....s..benchmark-tas...jobsAvailable
.i..$.jy....s..benchmark-tas...jobsAvailable
.9	Dn..Z....x..benchmark-tas...jobsAvailable
.i.3$.j.....s..benchmark-tas...jobsAvailable
.i.i$.j.....s..benchmark-tas...jobsAvailable
.9	.n.......x..benchmark-tas...jobsAvailable
.i..$.k.....s..benchmark-tas...jobsAvailable
y*h....L....<..benchmark-tas...jobsAvailable
.i..$.kf....s..benchmark-tas...jobsAvailable
.i..$.k.....s..benchmark-tas...jobsAvailable
.i.X$.k.....s..benchmark-tas...jobsAvailable
100 packets captured
142 packets received by filter
0 packets dropped by kernel
medic-y-2023-cw-08-5ca2147-benchmark-zeebe-gateway-5c8564cnxcgq# exit
Session ended, the ephemeral container will not be restarted but may be reattached using 'kubectl attach medic-y-2023-cw-08-5ca2147-benchmark-zeebe-gateway-5c8564cnxcgq -c debugger-wzclg -i -t' if it is still running
[cqjawa ~/ cluster: zeebe-cluster ns:medic-y-2023-cw-08-5ca2147-benchmark]$  kubectl debug -it --image=nicolaka/netshoot --target=zeebe-gateway medic-y-2023-cw-08-5ca2147-benchmark-zeebe-gateway-5c8564ckzbqx
Targeting container "zeebe-gateway". If you don't see processes from this container it may be because the container runtime doesn't support this feature.
Defaulting debug container name to debugger-qfnbm.
If you don't see a command prompt, try pressing enter.
medic-y-2023-cw-08-5ca2147-benchmark-zeebe-gateway-5c8564ckzbqx#  tcpdump -i any -A -s 0 -c 100 | grep -e 'jobs'
tcpdump: data link type LINUX_SLL2
tcpdump: verbose output suppressed, use -v[v]... for full protocol decode
listening on any, link-type LINUX_SLL2 (Linux cooked v2), snapshot length 262144 bytes
....<8......x..benchmark-tas...jobsAvailable
100 packets captured
377 packets received by filter
0 packets dropped by kernel
```

Furthermore, `medic-y-2023-cw-08-5ca2147-benchmark-zeebe-gateway-5c8564ckzbqx` is getting worker requests but 
`medic-y-2023-cw-08-5ca2147-benchmark-zeebe-gateway-5c8564cnxcgq` not.

```
medic-y-2023-cw-08-5ca2147-benchmark-zeebe-gateway-5c8564ckzbqx#  tcpdump -i any -A -s 0 -c 100 | grep -e 'worker'
tcpdump: data link type LINUX_SLL2
tcpdump: verbose output suppressed, use -v[v]... for full protocol decode
listening on any, link-type LINUX_SLL2 (Linux cooked v2), snapshot length 262144 bytes
..tR<9b.......n..........)..7........67......deadline.......[Z.worker.benchmark-worker.retries..retryBackoff..recurringTime..type.benchmark-task.customHeaders..variables.6...tvJFlXSdsfPnHVp....SAHNieyrwmrSDZ...ITyFQhV..LFdduCxfAMNyEjQS..oQ..NCLIfTwuiV.AUq.jzHxWtwRzR.e.uXnPoDUI.BHbaQ.rHsJmZcfbv.M.wX..fdaoNrIuBq....aFPyoNpav.SXpZz.ligLsqLJT.rbGdHUMeveNXJbSYPS.huKHAdCBP.PXFlq.qCulsDmyHg.H.WTrnkAmzyY.y.DAciebpKD..4...BvxrobzDJ....sUapekcWV..VXjrEEwSiL....AguMhvePb.U.OTbmreJswO....lCJGKvSFEd.a.zf....RQ..wYYzOuepgs....JKcsaSb..&.pWKlPSr.EEBWo.dVLDqp..%.PqBqip.i.VOIHKacxSG......NRwkafPQtI....hLjdXpGNFB.T.LVTZXTnvaH...F..BkEazLFbip..ycYhMWNcEJ....VmuPZYWwC..IZtRjCAqtQ....vYlTFpUwAv.w.VWaBkxFuE...NZXmRMaLb..
100 packets captured
439 packets received by filter
0 packets dropped by kernel
medic-y-2023-cw-08-5ca2147-benchmark-zeebe-gateway-5c8564ckzbqx# exit
Session ended, the ephemeral container will not be restarted but may be reattached using 'kubectl attach medic-y-2023-cw-08-5ca2147-benchmark-zeebe-gateway-5c8564ckzbqx -c debugger-qfnbm -i -t' if it is still running
[cqjawa ~/ cluster: zeebe-cluster ns:medic-y-2023-cw-08-5ca2147-benchmark]$  kubectl debug -it --image=nicolaka/netshoot --target=zeebe-gateway medic-y-2023-cw-08-5ca2147-benchmark-zeebe-gateway-5c8564cnxcgq
Targeting container "zeebe-gateway". If you don't see processes from this container it may be because the container runtime doesn't support this feature.
Defaulting debug container name to debugger-tm5nn.
If you don't see a command prompt, try pressing enter.
medic-y-2023-cw-08-5ca2147-benchmark-zeebe-gateway-5c8564cnxcgq#  tcpdump -i any -A -s 0 -c 100 | grep -e 'worker'
tcpdump: data link type LINUX_SLL2
tcpdump: verbose output suppressed, use -v[v]... for full protocol decode
listening on any, link-type LINUX_SLL2 (Linux cooked v2), snapshot length 262144 bytes
100 packets captured
231 packets received by filter
0 packets dropped by kernel
```

I scaled the gateway down to one replica to see whether it makes an difference.

**Comment by Zelldon** [comment]
```
$ k delete podstarter-7c9f86fcbb-48d6xx
pod "starter-7c9f86fcbb-48d6x" deleted
[cqjawa ~/ cluster: zeebe-cluster ns:medic-y-2023-cw-08-5ca2147-benchmark]$ timedatectl 
               Local time: Thu 2023-03-09 11:22:58 CET
           Universal time: Thu 2023-03-09 10:22:58 UTC
                 RTC time: Thu 2023-03-09 10:22:58
                Time zone: Europe/Berlin (CET, +0100)
System clock synchronized: yes
              NTP service: active
          RTC in local TZ: no
```
![Uploading starter-error-1.png…]()

**Comment by Zelldon** [comment]
To remove IPs

```
# tcpdump -i any -A -s 0 | grep -e 'In  IP 10' | awk '!/10.0.12.197|10.0.4.7|10.0.21.6/'
```

**Comment by Zelldon** [comment]
Similar way to find this IP with [tshark](https://www.wireshark.org/docs/man-pages/tshark.html)

```
# tshark -f "tcp port 26500 and not(host 10.0.4.7 or host 10.0.21.6 or host 10.0.12.197)" -T fields -e ip.src -e tcp.srcport -e ip.dst -e tcp.dstport -E header=y -E separator=, -E quote=d
```

Thanks to @oleschoenburg

**Comment by oleschoenburg** [comment]
[Logs](https://console.cloud.google.com/logs/query;query=resource.type%3D%22k8s_cluster%22%20AND%20log_id%2528%22cloudaudit.googleapis.com%2Factivity%22%2529%20AND%20resource.labels.cluster_name%3D%22zeebe-cluster%22%20AND%20resource.labels.location%3D%22europe-west1-b%22%20AND%20protoPayload.methodName%3D~%22io.k8s.core.v1.pods.%2528create%7Cdelete%2529%22%20severity%3E%3DDEFAULT%2010.0.20.1;timeRange=2023-03-07T06:10:25.795Z%2F2023-03-07T07:10:25.795Z;cursorTimestamp=2023-03-07T07:10:25.794587Z?project=zeebe-io) show that the `10.0.20.1` ip used to belong to pod `e2e-worker-5978b88bf9-68fq6` until that pod was (supposedly) deleted at 2023-03-07 08:10:25.794 CET.

**Comment by Zelldon** [comment]
I checked again the metrics from which gateway this is reported, maybe we have again some issue like #11330 
![gw](https://user-images.githubusercontent.com/2758593/224016869-6f357a3d-d652-4ba7-8919-c0b6d9047982.png)

The reported 150PI/s metric is not from the current running gateway, which also explains why we haven't seen in the tcpdump, no more creations of instances.

The current pods:
```
[cqjawa ~/ cluster: zeebe-cluster ns:medic-y-2023-cw-08-5ca2147-benchmark]$ kgpo
NAME                                                              READY   STATUS      RESTARTS      AGE
camunda-platform-curator-27972705-9qpqt                           0/1     Completed   0             13m
elasticsearch-master-0                                            1/1     Running     0             44h
elasticsearch-master-1                                            1/1     Running     0             4d14h
elasticsearch-master-2                                            1/1     Running     0             12h
leader-balancer-27972705-rqxbb                                    0/1     Completed   0             13m
medic-y-2023-cw-08-5ca2147-benchmark-zeebe-0                      1/1     Running     0             8d
medic-y-2023-cw-08-5ca2147-benchmark-zeebe-1                      1/1     Running     0             5d8h
medic-y-2023-cw-08-5ca2147-benchmark-zeebe-2                      1/1     Running     0             8d
medic-y-2023-cw-08-5ca2147-benchmark-zeebe-gateway-5c8564c29pwh   0/1     Error       0             46h
medic-y-2023-cw-08-5ca2147-benchmark-zeebe-gateway-5c8564chpb9h   0/1     Error       0             5d20h
medic-y-2023-cw-08-5ca2147-benchmark-zeebe-gateway-5c8564ckzbqx   1/1     Running     4 (43m ago)   12h
medic-y-2023-cw-08-5ca2147-benchmark-zeebe-gateway-5c8564cm7gjl   0/1     Error       0             3d7h
medic-y-2023-cw-08-5ca2147-benchmark-zeebe-gateway-5c8564cpmm24   0/1     Error       0             2d22h
medic-y-2023-cw-08-5ca2147-benchmark-zeebe-gateway-5c8564cwggnk   0/1     Error       0             5d14h
worker-6b7c4769cc-45nkv                                           0/1     Error       0             4d9h
worker-6b7c4769cc-6bqdf                                           1/1     Running     0             44h
worker-6b7c4769cc-csh6x                                           1/1     Running     0             3d7h
worker-6b7c4769cc-ssxqx                                           0/1     Error       0             46h
worker-6b7c4769cc-wfdvm                                           0/1     Error       0             3d22h
worker-6b7c4769cc-wtsng                                           1/1     Running     0             7d21h
worker-6b7c4769cc-x6rfr                                           0/1     Error       0             3d7h
```

**medic-y-2023-cw-08-5ca2147-benchmark-zeebe-gateway-5c8564cpmm24** is in error state:



```
Annotations:      <none>
Status:           Failed
Reason:           Terminated
Message:          Pod was terminated in response to imminent node shutdown.
IP:               10.0.20.21
IPs:
  IP:           10.0.20.21
Controlled By:  ReplicaSet/medic-y-2023-cw-08-5ca2147-benchmark-zeebe-gateway-5c8564cb46
Containers:
  zeebe-gateway:
    Container ID:   containerd://70f6486bdc99e016adf04334a79032cf71f278e24c9d67b91d3faece1603e7fb
    Image:          gcr.io/zeebe-io/zeebe:medic-y-2023-cw-08-5ca2147-benchmark-5ca2147
    Image ID:       gcr.io/zeebe-io/zeebe@sha256:4c5a9c375d533e3a4e55eaa9b2411ecdb2a0256a12fb05f9dc4a6cc4ec9ab393
    Ports:          9600/TCP, 26500/TCP, 26502/TCP
    Host Ports:     0/TCP, 0/TCP, 0/TCP
    State:          Terminated
      Reason:       Error
      Exit Code:    143
      Started:      Mon, 06 Mar 2023 14:50:51 +0100
      Finished:     Mon, 06 Mar 2023 15:37:30 +0100
    Ready:          False
    Restart Count:  0

```

After deleting the pod:

```
k delete pod medic-y-2023-cw-08-5ca2147-benchmark-zeebe-gateway-5c8564cpmm24
```

![done](https://user-images.githubusercontent.com/2758593/224017662-d760e93e-d062-40f2-a537-a113a1803082.png)

\cc @oleschoenburg

**Comment by Zelldon** [comment]
Since the IP we found before, is not findable and the request it sends are zero length I think this is nothing we look into further. It might be some system related thing, like kube-dns or something similar.

Deleting the gateway pod resolved the metrics issue. Still, it is not clear why the workers stopped at some point, It might be related to https://github.com/camunda/zeebe/issues/11975#issuecomment-1461731874 that one gateway received the notifications but had not workers to send requests to.

**Comment by Zelldon** [comment]
On the way of understanding better why job completion suddenly decreased I had a deeper look at the metrics around the failure time.


One Hypothesis was as written [here](https://github.com/camunda/zeebe/issues/11975#issuecomment-1461918928) that one gateway doesn't get the job notifications, but this doesn't seem to be true.

![jobnotifications](https://user-images.githubusercontent.com/2758593/224060052-aac2598d-aca6-41fb-b6b6-caf539c98d64.png)
 
Backpressure doesn't seem to have an influence either

![jobresource](https://user-images.githubusercontent.com/2758593/224060510-8b1588c0-051b-4fdd-9883-72f1fe7d3248.png)


Interesting point I can see [in the logs is that the partition becoming healthy and unhealthy in a ping-pong way.](https://console.cloud.google.com/logs/query;query=resource.type%3D%22k8s_container%22%0Aresource.labels.project_id%3D%22zeebe-io%22%0Aresource.labels.location%3D%22europe-west1-b%22%0Aresource.labels.cluster_name%3D%22zeebe-cluster%22%0Aresource.labels.namespace_name%3D%22medic-y-2023-cw-08-5ca2147-benchmark%22%0Alabels.k8s-pod%2Fapp%3D%22camunda-platform%22%0Alabels.k8s-pod%2Fapp_kubernetes_io%2Fcomponent%3D%22zeebe-broker%22%0Alabels.k8s-pod%2Fapp_kubernetes_io%2Finstance%3D%22medic-y-2023-cw-08-5ca2147-benchmark%22%0Alabels.k8s-pod%2Fapp_kubernetes_io%2Fmanaged-by%3D%22Helm%22%0Alabels.k8s-pod%2Fapp_kubernetes_io%2Fname%3D%22zeebe%22%0Alabels.k8s-pod%2Fapp_kubernetes_io%2Fpart-of%3D%22camunda-platform%22;timeRange=2023-03-08T17:20:51.844Z%2F2023-03-08T17:20:51.844Z--PT1H;pinnedLogId=2023-03-08T17:17:13.136692904Z%2Ffsi2vn3993ec37vx;cursorTimestamp=2023-03-08T17:17:39.610853821Z?project=zeebe-io)
Similar already reported here #11954 

![health](https://user-images.githubusercontent.com/2758593/224061036-b104590a-89cb-4ba2-aa30-a88d939f8e35.png)


This seems to be the case for the last 2 days.

![health2](https://user-images.githubusercontent.com/2758593/224061360-7b02e9b3-f30c-4d1c-b9de-9c0aad64e0f7.png)

**Comment by Zelldon** [comment]
The logs give not much interesting insights

Only in the gateway we see around the time that a [request fails](https://console.cloud.google.com/logs/query;query=resource.type%3D%22k8s_container%22%0Aresource.labels.project_id%3D%22zeebe-io%22%0Aresource.labels.location%3D%22europe-west1-b%22%0Aresource.labels.cluster_name%3D%22zeebe-cluster%22%0Aresource.labels.namespace_name%3D%22medic-y-2023-cw-08-5ca2147-benchmark%22%0Alabels.k8s-pod%2Fapp%3D%22camunda-platform%22%0Alabels.k8s-pod%2Fapp_kubernetes_io%2Fcomponent%3D%22zeebe-gateway%22%0Alabels.k8s-pod%2Fapp_kubernetes_io%2Finstance%3D%22medic-y-2023-cw-08-5ca2147-benchmark%22%0Alabels.k8s-pod%2Fapp_kubernetes_io%2Fmanaged-by%3D%22Helm%22%0Alabels.k8s-pod%2Fapp_kubernetes_io%2Fname%3D%22zeebe-gateway%22%0Alabels.k8s-pod%2Fapp_kubernetes_io%2Fpart-of%3D%22camunda-platform%22;timeRange=2023-03-07T17:17:42.937Z%2F2023-03-07T17:17:42.937Z--PT1H;pinnedLogId=2023-03-07T17:20:02.397262772Z%2F3v7wc72kdht8bayx;cursorTimestamp=2023-03-07T17:20:02.397262772Z?project=zeebe-io)

And later the ping-pong of healthiness is causing also updates on the gateway

```
DEBUG 2023-03-07T17:21:07.197149597Z [resource.labels.containerName: zeebe-gateway] Received REACHABILITY_CHANGED for broker 0, do nothing.
DEBUG 2023-03-07T17:21:07.206883498Z [resource.labels.containerName: zeebe-gateway] Received REACHABILITY_CHANGED for broker 0, do nothing.
DEBUG 2023-03-07T17:21:08.911572770Z [resource.labels.containerName: zeebe-gateway] Received REACHABILITY_CHANGED for broker 0, do nothing.
DEBUG 2023-03-07T17:21:09.000987765Z [resource.labels.containerName: zeebe-gateway] Received REACHABILITY_CHANGED for broker 0, do nothing.
```

**Comment by Zelldon** [comment]
Since I went the last days a bit from a to b, and was a bit verbose in my investigation (helps me to collect and keep information). I want to summarize what we now know.

## Summary:

### What do we know

 * instances have been continuously created
   * [it looked like that the process instance rate where doubled](https://github.com/camunda/zeebe/issues/11975#issuecomment-1461736282), but this was a [false flag](https://github.com/camunda/zeebe/issues/11975#issuecomment-1461912347) reported by an gateway in error state
 * Worker completions dropped (see below for more)
   * One assumption was that it was based on missing job notifications, based on the metrics we can see that two gateways are receiving job notifications
 * [Unhealthy ping-pong started at some point](https://github.com/camunda/zeebe/issues/11975#issuecomment-1462191612) - _a **symptom** of having a larger state which increases processing time, which makes stream processor not able to report in time back for the health check_ Related #11954 
 * Long restart time - symptom of having larger state
 * Resource consumption (disk) - symptom of having larger state - causes at some point also unhealthines

#### Job Worker completions

Based on the previous investigation we had still these open questions: 

1. Why worker completions dropped
2. How does job activation batch size look like, did it decreased? We need more metrics. Job batch sizes, job completions in worker, activation rate
3. Connections between worker and gateway?

I investigated a bit further these questions and found for example the following [Job metrics ](https://github.com/camunda/zeebe/blob/main/engine/src/main/java/io/camunda/zeebe/engine/metrics/JobMetrics.java). (Who was aware of these :sweat_smile: there are not part of our dashboard btw.)

The job metrics gave interesting insights.

![jobs](https://user-images.githubusercontent.com/2758593/224247146-69c2de28-e0d2-4f3e-b99f-0239ff610a6e.png)

1. We have almost never active long polling, which makes the point of missing job notifications not interesting.
2. Job activation drops at the time we see our throughput drop (~18:20), which explains why the completion dropped. 
3. We can see based on GRPC metrics and the custom Job metrics that the job activation has dropped, indicating an issue on the client side, not on the gateway nor broker.
  1. Backpressure doesn't seem to play a role here.
4. Only one gateway is receiving the job activations, similar to #11310 

## 5 Whys

1. Why did the benchmark throughput dropped?
    - The job completions stopped, by a significant factor
3. Why did the job completions stop?
    - The job activation has been reduced
4. Why has the job activation been reduced?
    - Based on the metrics not the same rate of requests has been sent by the worker to the gateway
5. Why did the worker not send the same rate of requests?
    - Not 100% clear. For that we need more insights into the client applications

## Conclusion

I will close this issue for now, as from my point of view is not a bug in Zeebe itself. It seems to be related either to the client application or infrastructure related.

It is likely that the workers may be sent requests to the wrong gateway, as we had ~5 gateway pods in error state when investigating and we have seen a similar things with the metrics, so this can't be excluded.

Right now the logging is not good in the client applications, we mostly see nothing (only errors/warning) or only noise. The metrics seem to disabled as well. As a follow-up I will improve the logging of the client applications and again enable the metrics for the application in order to see the following:

1. the seen topology
2. the rate of requests it sents (success and failure)
3. the gateway to which the requests are sent to

Since we accumulated a lot of state right now it will take a while until we reach again a stable state for this benchmark.
